{
  "schemaVersion": "email-reply-draft-proposal.v2",
  "proposalId": "draft-0001",
  "factsDigest": "95db8498651e03d434755c2a3c97e73be389448159dc445ee0f6e204fd458da5",
  "source": {
    "provider": "gmail",
    "accountId": "jobs@example.test",
    "messageId": "message-1",
    "threadId": "thread-1",
    "replyToAddress": "recruiter@example.test"
  },
  "recipient": "recruiter@example.test",
  "subject": "Re: Application communication",
  "body": "Thanks for reaching out. I am glad to continue the conversation and will follow up with the requested details shortly.",
  "bodyDigest": "d1c1a687fb16bc94690273a41b7568f1a78cbeae76de4f314740879bf45c7415",
  "purpose": "information_response",
  "authorship": "model",
  "expiresAt": "2026-07-26T02:00:00.000Z",
  "sensitiveDataScan": "passed",
  "toneDecisionId": "tone-0001",
  "toneDecisionDigest": "bbbbbbbbbbbbbbbbbbbbbbbbbbbbbbbbbbbbbbbbbbbbbbbbbbbbbbbbbbbbbbbb",
  "voiceRevisionId": "voice-0001",
  "voiceRevisionDigest": "cccccccccccccccccccccccccccccccccccccccccccccccccccccccccccccccc",
  "sourceStateSha256": "aaaaaaaaaaaaaaaaaaaaaaaaaaaaaaaaaaaaaaaaaaaaaaaaaaaaaaaaaaaaaaaa",
  "registerAdaptationOnly": true,
  "distinctivePhraseReuse": false,
  "requiresReview": true,
  "autoSendEligible": false
}
